{
  "schemaVersion": 1,
  "eventId": "33333333-3333-4333-8333-333333333333",
  "type": "media.completed.v1",
  "jobId": "22222222-2222-4222-8222-222222222222",
  "attemptId": "44444444-4444-4444-8444-444444444444",
  "sequence": 3,
  "occurredAt": "2026-09-12T10:01:30Z",
  "payload": {
    "artifactKey": "artifact.json"
  }
}
